,Created at,User ID,User Name,Text,Description,Location,Followers Count,Friends Count,Statuses Count,Profile Image Url
305,Sun Sep 04 09:28:15 +0000 2022,1566357463481434115,Fabrizio Romano,"RT @caughtoffside: 🚨 EXCLUSIVE 🚨

🔵 The midfielders #CFC wanted before Zakaria

🔴 Why Arsenal didn't sign Tielemans or Luiz

And more 👇👇",Here we go! ©,"Milano, Italia",12102411,2160,20399,http://pbs.twimg.com/profile_images/1486761402853380113/3ifAqala_normal.jpg
306,Sun Sep 04 08:27:00 +0000 2022,1566342048625479680,Fabrizio Romano,"Barcelona wanted to sign Julián Araujo as he's highly rated, impressive talent - one for the future. There was no a… https://t.co/hMZvVMl2rt",Here we go! ©,"Milano, Italia",12102411,2160,20399,http://pbs.twimg.com/profile_images/1486761402853380113/3ifAqala_normal.jpg
307,Sat Sep 03 19:53:21 +0000 2022,1566152388477685766,Fabrizio Romano,"AC Milan manager Pioli on Rafa Leão: ""The club wants to offer Leão a new deal soon. They will take care of it - he'… https://t.co/GU1hYhKGjD",Here we go! ©,"Milano, Italia",12102411,2160,20399,http://pbs.twimg.com/profile_images/1486761402853380113/3ifAqala_normal.jpg
308,Sat Sep 03 19:39:50 +0000 2022,1566148987224195074,Fabrizio Romano,@theboysammyjay @TheSecretScout_ 😉 exclusive news… thanks mate,Here we go! ©,"Milano, Italia",12102411,2160,20399,http://pbs.twimg.com/profile_images/1486761402853380113/3ifAqala_normal.jpg
309,Sat Sep 03 19:12:19 +0000 2022,1566142060184338433,Fabrizio Romano,Chelsea bid for Romeo Lavia was immediately rejected by Southampton. £50m turned down as they consider Romeo one of… https://t.co/InhNdHwF5r,Here we go! ©,"Milano, Italia",12102411,2160,20399,http://pbs.twimg.com/profile_images/1486761402853380113/3ifAqala_normal.jpg
310,Sat Sep 03 18:10:18 +0000 2022,1566126452793384960,Fabrizio Romano,@CanalSupporters 🤝,Here we go! ©,"Milano, Italia",12102411,2160,20399,http://pbs.twimg.com/profile_images/1486761402853380113/3ifAqala_normal.jpg
311,Sat Sep 03 18:05:23 +0000 2022,1566125217981861889,Fabrizio Romano,"Rafinha leaves Paris Saint-Germain and joins Al Arabi Qatar. Been told it’s permanent move, joins on free transfer… https://t.co/xXuV3MdkUo",Here we go! ©,"Milano, Italia",12102411,2160,20399,http://pbs.twimg.com/profile_images/1486761402853380113/3ifAqala_normal.jpg
312,Sat Sep 03 17:42:29 +0000 2022,1566119455352098817,Fabrizio Romano,@AlfieHouseEcho @J_Tanswell 👌🏻,Here we go! ©,"Milano, Italia",12102411,2160,20399,http://pbs.twimg.com/profile_images/1486761402853380113/3ifAqala_normal.jpg
313,Sat Sep 03 17:42:22 +0000 2022,1566119422238023685,Fabrizio Romano,@J_Tanswell @TheAthleticUK thanks 🤝,Here we go! ©,"Milano, Italia",12102411,2160,20399,http://pbs.twimg.com/profile_images/1486761402853380113/3ifAqala_normal.jpg
314,Sat Sep 03 16:56:16 +0000 2022,1566107822386978821,Fabrizio Romano,Behind the scenes. Chelsea wanted to sign Romeo Lavia on Deadline Day with £50m verbal proposal rejected by Southam… https://t.co/1H14KpToX5,Here we go! ©,"Milano, Italia",12102411,2160,20399,http://pbs.twimg.com/profile_images/1486761402853380113/3ifAqala_normal.jpg
315,Sat Sep 03 16:51:49 +0000 2022,1566106702210007040,Fabrizio Romano,@ibrahima_OM 😏,Here we go! ©,"Milano, Italia",12102411,2160,20399,http://pbs.twimg.com/profile_images/1486761402853380113/3ifAqala_normal.jpg
316,Sat Sep 03 15:41:20 +0000 2022,1566088964313911297,Fabrizio Romano,Inter CEO Marotta on Milan Škriniar deal with PSG: “Our owners have been very clear: they’ve rejected all the propo… https://t.co/Yr3wEQS2wh,Here we go! ©,"Milano, Italia",12102411,2160,20399,http://pbs.twimg.com/profile_images/1486761402853380113/3ifAqala_normal.jpg
317,Sat Sep 03 14:02:41 +0000 2022,1566064140174741506,Fabrizio Romano,Jurrien Timber tells @ADnl: “It was fake that was Louis van Gaal who told me not to go to Manchester United this su… https://t.co/IQcqhi4ydP,Here we go! ©,"Milano, Italia",12102411,2160,20399,http://pbs.twimg.com/profile_images/1486761402853380113/3ifAqala_normal.jpg
318,Sat Sep 03 09:37:00 +0000 2022,1565997276731805697,Fabrizio Romano,Tottenham and Olympique Marseille wanted Ruslan Malinovskyi on loan with buy option. Player's dream was to join Spu… https://t.co/BlH5coYnoy,Here we go! ©,"Milano, Italia",12102411,2160,20399,http://pbs.twimg.com/profile_images/1486761402853380113/3ifAqala_normal.jpg
319,Sat Sep 03 07:41:00 +0000 2022,1565968084229185536,Fabrizio Romano,"Torino director Vagnati: ""We will buy Radonjic from OM, he will be our player on permanent deal - he reduced his sa… https://t.co/DXPqUTysFK",Here we go! ©,"Milano, Italia",12102411,2160,20399,http://pbs.twimg.com/profile_images/1486761402853380113/3ifAqala_normal.jpg
320,Sat Sep 03 06:48:00 +0000 2022,1565954746275577858,Fabrizio Romano,"Wolves will offer Ruben Neves a new contract, Bruno Lage confirms: ""We need time to sort Ruben a new contract"". 🟠🇵🇹… https://t.co/ZMnu2IzgH8",Here we go! ©,"Milano, Italia",12102412,2160,20399,http://pbs.twimg.com/profile_images/1486761402853380113/3ifAqala_normal.jpg
321,Fri Sep 02 21:25:46 +0000 2022,1565813257557970945,Fabrizio Romano,"Marcelo to Olympiacos, here we go! Full agreement completed — Real Madrid legend joins Greek side on one-year deal,… https://t.co/o70YvOPB41",Here we go! ©,"Milano, Italia",12102412,2160,20399,http://pbs.twimg.com/profile_images/1486761402853380113/3ifAqala_normal.jpg
322,Fri Sep 02 21:22:53 +0000 2022,1565812531779747840,Fabrizio Romano,"Here’s Denis Zakaria today after his first day as new Chelsea player — in the pic with Todd Boehly, Behdad Eghbali… https://t.co/w5dHorV6Mt",Here we go! ©,"Milano, Italia",12102412,2160,20399,http://pbs.twimg.com/profile_images/1486761402853380113/3ifAqala_normal.jpg
323,Fri Sep 02 20:04:35 +0000 2022,1565792825534566401,Fabrizio Romano,"First call @elchiringuitotv after many proposals for Marcelo, Olympiacos are finally close to complete the deal. Le… https://t.co/6YDcZsKzM9",Here we go! ©,"Milano, Italia",12102412,2160,20399,http://pbs.twimg.com/profile_images/1486761402853380113/3ifAqala_normal.jpg
324,Fri Sep 02 20:01:08 +0000 2022,1565791958592888838,Fabrizio Romano,"Real Madrid legend Marcelo is really close to join Olympiacos. Talks now in progress to join as free agent, it’s im… https://t.co/4ghfkVhkJZ",Here we go! ©,"Milano, Italia",12102412,2160,20399,http://pbs.twimg.com/profile_images/1486761402853380113/3ifAqala_normal.jpg
325,Fri Sep 02 19:56:06 +0000 2022,1565790690772226048,Fabrizio Romano,The incredible story of Bamba Dieng transfer is over. No agreement after talks between OGC Nice and OM in the last… https://t.co/WuwK1pNUF8,Here we go! ©,"Milano, Italia",12102412,2160,20399,http://pbs.twimg.com/profile_images/1486761402853380113/3ifAqala_normal.jpg
326,Fri Sep 02 18:34:19 +0000 2022,1565770111012806657,Fabrizio Romano,Official. Armando Broja signs new six year deal with Chelsea as part of the project for the next years — Thomas Tuc… https://t.co/mYYyGUHhj6,Here we go! ©,"Milano, Italia",12102412,2160,20399,http://pbs.twimg.com/profile_images/1486761402853380113/3ifAqala_normal.jpg
327,Fri Sep 02 18:30:09 +0000 2022,1565769062810091523,Fabrizio Romano,Chelsea are set to announce new contract for Armando Broja 🔵👀 #CFC,Here we go! ©,"Milano, Italia",12102412,2160,20399,http://pbs.twimg.com/profile_images/1486761402853380113/3ifAqala_normal.jpg
328,Fri Sep 02 17:18:13 +0000 2022,1565750958931451904,Fabrizio Romano,"Marcos Alonso, new Barça player as expected. 🔵🔴 #FCB #FCBlive https://t.co/ulFcO2Md69",Here we go! ©,"Milano, Italia",12102412,2160,20399,http://pbs.twimg.com/profile_images/1486761402853380113/3ifAqala_normal.jpg
329,Fri Sep 02 17:17:40 +0000 2022,1565750818753708032,Fabrizio Romano,@herve_lucien @MohamedTERParis merci!,Here we go! ©,"Milano, Italia",12102412,2160,20399,http://pbs.twimg.com/profile_images/1486761402853380113/3ifAqala_normal.jpg
330,Fri Sep 02 16:19:52 +0000 2022,1565736275772055560,Fabrizio Romano,"Newcastle wanted Lucas Moura as they approached Tottenham during Deadline Day, same for Aston Villa. Spurs decided… https://t.co/Haf5eKiTv9",Here we go! ©,"Milano, Italia",12102412,2160,20399,http://pbs.twimg.com/profile_images/1486761402853380113/3ifAqala_normal.jpg
331,Fri Sep 02 16:18:24 +0000 2022,1565735903632531466,Fabrizio Romano,"Marcos Alonso, all documents are ready to unveil the final signing for Barcelona. Xavi: “The registration of Alonso… https://t.co/rZoq0n0Ndd",Here we go! ©,"Milano, Italia",12102412,2160,20399,http://pbs.twimg.com/profile_images/1486761402853380113/3ifAqala_normal.jpg
332,Fri Sep 02 16:18:19 +0000 2022,1565735882551877635,Fabrizio Romano,"RT @Sorare: Transfer season may be over, but scouting season never is. 😉

Fresh off Deadline Day, @FabrizioRomano gives you 5 transfers fro…",Here we go! ©,"Milano, Italia",12102412,2160,20399,http://pbs.twimg.com/profile_images/1486761402853380113/3ifAqala_normal.jpg
333,Fri Sep 02 12:31:49 +0000 2022,1565678885227962370,Fabrizio Romano,"Jason Denayer, available as a free agent. Wolves manager Bruno Lage: “Let’s see what happens in the next days, I kn… https://t.co/6kaCMuOvBu",Here we go! ©,"Milano, Italia",12102412,2160,20399,http://pbs.twimg.com/profile_images/1486761402853380113/3ifAqala_normal.jpg
334,Fri Sep 02 12:19:36 +0000 2022,1565675808504569857,Fabrizio Romano,"Arteta on Douglas Luiz: “We tried… and at the end of the day, we have to bring in the players we feel are right - b… https://t.co/QtXjcTCZG8",Here we go! ©,"Milano, Italia",12102412,2160,20399,http://pbs.twimg.com/profile_images/1486761402853380113/3ifAqala_normal.jpg
335,Fri Sep 02 12:14:50 +0000 2022,1565674609269243906,Fabrizio Romano,Tuchel: “You know what you get with Auba and he was very happy to come back to the Premier League. He can deliver g… https://t.co/2S3g8Z0LPf,Here we go! ©,"Milano, Italia",12102412,2160,20399,http://pbs.twimg.com/profile_images/1486761402853380113/3ifAqala_normal.jpg
336,Fri Sep 02 11:56:14 +0000 2022,1565669929772261376,Fabrizio Romano,"Official, confirmed. Jan Vertonghen leaves Benfica and joins Anderlecht as deal has been completed. 🚨🟣 #transfers https://t.co/K5v1M7GsH2",Here we go! ©,"Milano, Italia",12102412,2160,20399,http://pbs.twimg.com/profile_images/1486761402853380113/3ifAqala_normal.jpg
337,Fri Sep 02 11:56:10 +0000 2022,1565669911837409280,Fabrizio Romano,Official. Michy Batshuayi leaves Chelsea and joins Fenerbahçe as deal has been completed today — after Nottingham F… https://t.co/eqMKHeDyD2,Here we go! ©,"Milano, Italia",12102412,2160,20399,http://pbs.twimg.com/profile_images/1486761402853380113/3ifAqala_normal.jpg
338,Fri Sep 02 08:38:11 +0000 2022,1565620087146663936,Fabrizio Romano,"Chelsea will pay €3m fixed loan fee to Juventus for Denis Zakaria, plus €1m add-ons. 🔵🤝 #CFC

Buy option will be av… https://t.co/sH8F993zc1",Here we go! ©,"Milano, Italia",12102412,2160,20399,http://pbs.twimg.com/profile_images/1486761402853380113/3ifAqala_normal.jpg
339,Fri Sep 02 07:46:29 +0000 2022,1565607077862588417,Fabrizio Romano,Leeds will pay €4.5m fixed fee plus add ons for Willy Gnonto. Sell-on clause also included. Medical already done an… https://t.co/H9SFGREkKR,Here we go! ©,"Milano, Italia",12102412,2160,20399,http://pbs.twimg.com/profile_images/1486761402853380113/3ifAqala_normal.jpg
340,Fri Sep 02 07:28:28 +0000 2022,1565602544457601024,Fabrizio Romano,@SalvaGomis97 0 horas jajaj,Here we go! ©,"Milano, Italia",12102414,2160,20399,http://pbs.twimg.com/profile_images/1486761402853380113/3ifAqala_normal.jpg
341,Fri Sep 02 06:53:45 +0000 2022,1565593807260995587,Fabrizio Romano,"Michy Batshuayi deal collapsed with Nottingham Forest because Chelsea didn’t send paperwork in time, busy on many d… https://t.co/OvhdkvY27a",Here we go! ©,"Milano, Italia",12102414,2160,20399,http://pbs.twimg.com/profile_images/1486761402853380113/3ifAqala_normal.jpg
342,Fri Sep 02 06:35:38 +0000 2022,1565589249054892033,Fabrizio Romano,"Official. William Carvalho extends the contract with Real Betis until June 2026, full agreement reached yesterday.… https://t.co/RHZh59yWzB",Here we go! ©,"Milano, Italia",12102414,2160,20399,http://pbs.twimg.com/profile_images/1486761402853380113/3ifAqala_normal.jpg
343,Fri Sep 02 06:34:26 +0000 2022,1565588944162635776,Fabrizio Romano,@BadeLoic @NFFC ✅,Here we go! ©,"Milano, Italia",12102414,2160,20399,http://pbs.twimg.com/profile_images/1486761402853380113/3ifAqala_normal.jpg
344,Fri Sep 02 06:05:19 +0000 2022,1565581616361127938,Fabrizio Romano,"@HenryM131 we’ve many years to rest, mate",Here we go! ©,"Milano, Italia",12102414,2160,20399,http://pbs.twimg.com/profile_images/1486761402853380113/3ifAqala_normal.jpg
345,Fri Sep 02 06:04:03 +0000 2022,1565581300576256001,Fabrizio Romano,Manchester City have completed the signing of German U17 international Farid Alfa-Ruprecht [born in 2006] beating C… https://t.co/8EQoXGjW6H,Here we go! ©,"Milano, Italia",12102414,2160,20399,http://pbs.twimg.com/profile_images/1486761402853380113/3ifAqala_normal.jpg
346,Fri Sep 02 02:58:35 +0000 2022,1565534626529116160,Fabrizio Romano,@DreCordero grazie amico! 🙏🏻😀,Here we go! ©,"Milano, Italia",12102414,2160,20399,http://pbs.twimg.com/profile_images/1486761402853380113/3ifAqala_normal.jpg
347,Fri Sep 02 02:41:58 +0000 2022,1565530443663003651,Fabrizio Romano,@Bernardismo2022 @NoChillsTim abrazo grande,Here we go! ©,"Milano, Italia",12102414,2160,20399,http://pbs.twimg.com/profile_images/1486761402853380113/3ifAqala_normal.jpg
348,Fri Sep 02 02:34:24 +0000 2022,1565528539746762753,Fabrizio Romano,@NoChillsTim it’s not Endrick. Nothing big. Relax 😂,Here we go! ©,"Milano, Italia",12102414,2160,20399,http://pbs.twimg.com/profile_images/1486761402853380113/3ifAqala_normal.jpg
349,Fri Sep 02 02:22:58 +0000 2022,1565525660759724040,Fabrizio Romano,@JamieoJohnson thanks a lot 😀🙏🏻,Here we go! ©,"Milano, Italia",12102414,2160,20399,http://pbs.twimg.com/profile_images/1486761402853380113/3ifAqala_normal.jpg
350,Fri Sep 02 02:21:58 +0000 2022,1565525409810288640,Fabrizio Romano,"Thanks guys to all of you for another incredible, mad, crazy window spent here together every single day ❤️👊🏻

‘Go… https://t.co/JZAuixkTYi",Here we go! ©,"Milano, Italia",12102414,2160,20399,http://pbs.twimg.com/profile_images/1486761402853380113/3ifAqala_normal.jpg
351,Fri Sep 02 02:17:12 +0000 2022,1565524212365889537,Fabrizio Romano,"“Describe your life in one pic”.

Me: https://t.co/VGBUBymSY0",Here we go! ©,"Milano, Italia",12102414,2160,20399,http://pbs.twimg.com/profile_images/1486761402853380113/3ifAqala_normal.jpg
352,Fri Sep 02 01:51:17 +0000 2022,1565517686540582912,Fabrizio Romano,@_Just_Malik thanks 🙏🏻,Here we go! ©,"Milano, Italia",12102414,2160,20399,http://pbs.twimg.com/profile_images/1486761402853380113/3ifAqala_normal.jpg
353,Fri Sep 02 01:35:07 +0000 2022,1565513619361697792,Fabrizio Romano,Norwegian striker Noah Holm will fly to France later today in order to complete his move to Stade de Reims. Clubs a… https://t.co/FvH8kZ9aIL,Here we go! ©,"Milano, Italia",12102414,2160,20399,http://pbs.twimg.com/profile_images/1486761402853380113/3ifAqala_normal.jpg
354,Fri Sep 02 00:15:38 +0000 2022,1565493616096808961,Fabrizio Romano,"Official, confirmed. Marcos Alonso leaves Chelsea by terminating the contract on mutual consent, as expected. 🚨🔵… https://t.co/mHLupenANk",Here we go! ©,"Milano, Italia",12102414,2160,20399,http://pbs.twimg.com/profile_images/1486761402853380113/3ifAqala_normal.jpg
355,Fri Sep 02 00:02:15 +0000 2022,1565490248401952768,Fabrizio Romano,"Official, confirmed. Denis Zakaria to Chelsea from Juventus on loan deal with £30m buy option clause. 🚨🔵 #CFC… https://t.co/1tqRDHf9Ly",Here we go! ©,"Milano, Italia",12102414,2160,20399,http://pbs.twimg.com/profile_images/1486761402853380113/3ifAqala_normal.jpg
356,Thu Sep 01 23:22:06 +0000 2022,1565480146143961088,Fabrizio Romano,"Official. Completed. Here we go.

Pierre Aubameyang joins Chelsea.

#DeadlineDay #CFC ✅🔵 https://t.co/XvBdOlXihI",Here we go! ©,"Milano, Italia",12102414,2160,20399,http://pbs.twimg.com/profile_images/1486761402853380113/3ifAqala_normal.jpg
357,Thu Sep 01 23:22:01 +0000 2022,1565480125772308480,Fabrizio Romano,"First call, August 3 during Cucurella night… 😂✅ #CFC https://t.co/GqXEQm4e5L",Here we go! ©,"Milano, Italia",12102414,2160,20399,http://pbs.twimg.com/profile_images/1486761402853380113/3ifAqala_normal.jpg
358,Thu Sep 01 23:14:35 +0000 2022,1565478255339126788,Fabrizio Romano,"Aubameyang: TMS done, now final document to be signed and then it will be official. ✅🔵 #CFC",Here we go! ©,"Milano, Italia",12102414,2160,20399,http://pbs.twimg.com/profile_images/1486761402853380113/3ifAqala_normal.jpg
359,Thu Sep 01 23:02:59 +0000 2022,1565475332718792706,Fabrizio Romano,✅👍 https://t.co/TauLP62gur,Here we go! ©,"Milano, Italia",12102414,2160,20399,http://pbs.twimg.com/profile_images/1486761402853380113/3ifAqala_normal.jpg
360,Thu Sep 01 22:56:34 +0000 2022,1565473721405636610,Fabrizio Romano,@CelticFC ✅👍,Here we go! ©,"Milano, Italia",12102411,2160,20399,http://pbs.twimg.com/profile_images/1486761402853380113/3ifAqala_normal.jpg
361,Thu Sep 01 22:52:37 +0000 2022,1565472725036056576,Fabrizio Romano,"Work permit sorted. Willy Gnonto will be new Leeds player from FC Zurich, done deal and here we go confirmed. 🚨✅… https://t.co/U9MEdxbtgs",Here we go! ©,"Milano, Italia",12102411,2160,20399,http://pbs.twimg.com/profile_images/1486761402853380113/3ifAqala_normal.jpg
362,Thu Sep 01 22:47:13 +0000 2022,1565471367033667588,Fabrizio Romano,"Official, confirmed. Daniel James has joined Fulham on loan deal from Leeds. 🚨⚪️ #LUFC #DeadlineDay",Here we go! ©,"Milano, Italia",12102411,2160,20399,http://pbs.twimg.com/profile_images/1486761402853380113/3ifAqala_normal.jpg
363,Thu Sep 01 22:33:53 +0000 2022,1565468012639027201,Fabrizio Romano,"Nottingham Forest update: Aurier and Bade deals are signed and will be announced soon, done. 🚨🔴🌳 #NFFC #DeadlineDay… https://t.co/YUhIo33NUx",Here we go! ©,"Milano, Italia",12102411,2160,20399,http://pbs.twimg.com/profile_images/1486761402853380113/3ifAqala_normal.jpg
364,Thu Sep 01 22:32:16 +0000 2022,1565467604877197313,Fabrizio Romano,Denis Zakaria is signing his Chelsea contract right now. 🚨🔵 #CFC #DeadlineDay,Here we go! ©,"Milano, Italia",12102411,2160,20399,http://pbs.twimg.com/profile_images/1486761402853380113/3ifAqala_normal.jpg
365,Thu Sep 01 22:29:48 +0000 2022,1565466984896151553,Fabrizio Romano,"RT @FabrizioRomano: Leeds are set to sign Willy Gnonto from FC Zurich! Deal almost done, just waiting for work permit then it will be the f…",Here we go! ©,"Milano, Italia",12102411,2160,20399,http://pbs.twimg.com/profile_images/1486761402853380113/3ifAqala_normal.jpg
366,Thu Sep 01 22:26:29 +0000 2022,1565466150426779648,Fabrizio Romano,Marcod Alonso joins Barcelona on a free transfer — contract termination has been signed. Official statement will be… https://t.co/ab4YZsnBQ3,Here we go! ©,"Milano, Italia",12102411,2160,20399,http://pbs.twimg.com/profile_images/1486761402853380113/3ifAqala_normal.jpg
367,Thu Sep 01 22:13:53 +0000 2022,1565462978123759619,Fabrizio Romano,Pierre Aubameyang has just signed contract his Chelsea contract — just waiting for official statement. 🚨🔵 #CFC #DeadlineDay,Here we go! ©,"Milano, Italia",12102411,2160,20399,http://pbs.twimg.com/profile_images/1486761402853380113/3ifAqala_normal.jpg
368,Thu Sep 01 22:08:39 +0000 2022,1565461661892354049,Fabrizio Romano,"Official, confirmed. Duje Caleta-Car joins Southampton on permanent deal from OM. 🚨 #DeadlineDay https://t.co/MOZwcePrva",Here we go! ©,"Milano, Italia",12102411,2160,20399,http://pbs.twimg.com/profile_images/1486761402853380113/3ifAqala_normal.jpg
369,Thu Sep 01 22:03:19 +0000 2022,1565460318897246209,Fabrizio Romano,"Leeds are set to sign Willy Gnonto from FC Zurich! Deal almost done, just waiting for work permit then it will be t… https://t.co/bFaxeBFjvM",Here we go! ©,"Milano, Italia",12102411,2160,20399,http://pbs.twimg.com/profile_images/1486761402853380113/3ifAqala_normal.jpg
370,Thu Sep 01 22:00:35 +0000 2022,1565459630330888194,Fabrizio Romano,"Official, confirmed. Hector Bellerín joins Barcelona on free transfer — one year deal. 🚨🔵🔴 #DeadlineDay",Here we go! ©,"Milano, Italia",12102411,2160,20399,http://pbs.twimg.com/profile_images/1486761402853380113/3ifAqala_normal.jpg
371,Thu Sep 01 21:58:51 +0000 2022,1565459194811129861,Fabrizio Romano,"Official, confirmed. Justin Kluivert joins Valencia on loan deal from AS Roma with €15m buy option. 🚨🔴 #DeadlineDay",Here we go! ©,"Milano, Italia",12102411,2160,20399,http://pbs.twimg.com/profile_images/1486761402853380113/3ifAqala_normal.jpg
372,Thu Sep 01 21:57:16 +0000 2022,1565458798231359489,Fabrizio Romano,"Official, confirmed. André Gomes joins Lille on loan deal from Everton. 🚨🔵 #EFC #DeadlineDay",Here we go! ©,"Milano, Italia",12102411,2160,20399,http://pbs.twimg.com/profile_images/1486761402853380113/3ifAqala_normal.jpg
373,Thu Sep 01 21:56:09 +0000 2022,1565458516768440321,Fabrizio Romano,"Official, confirmed. Jan Bednarek has now joined Aston Villa from Southampton. 🚨 #DeadlineDay",Here we go! ©,"Milano, Italia",12102411,2160,20399,http://pbs.twimg.com/profile_images/1486761402853380113/3ifAqala_normal.jpg
374,Thu Sep 01 21:51:02 +0000 2022,1565457226566885384,Fabrizio Romano,"Official, confirmed. Tahith Chong joins Birmingham City and leaves Man United on permanent deal. 🚨🔵 #BCFC #DeadlineDay",Here we go! ©,"Milano, Italia",12102411,2160,20399,http://pbs.twimg.com/profile_images/1486761402853380113/3ifAqala_normal.jpg
375,Thu Sep 01 21:48:06 +0000 2022,1565456487689986049,Fabrizio Romano,"Official, confirmed. Fulham sign Carlos Vinicius from Benfica for £4.25m. 🚨⚪️ #DeadlineDay https://t.co/sdJpmEZyw0",Here we go! ©,"Milano, Italia",12102411,2160,20399,http://pbs.twimg.com/profile_images/1486761402853380113/3ifAqala_normal.jpg
376,Thu Sep 01 21:46:57 +0000 2022,1565456201789440003,Fabrizio Romano,"Official, confirmed. Amine Harit has joined Olympique Marseille on loan with buy option. 🚨🔵 #OM #DeadlineDay",Here we go! ©,"Milano, Italia",12102411,2160,20399,http://pbs.twimg.com/profile_images/1486761402853380113/3ifAqala_normal.jpg
377,Thu Sep 01 21:44:52 +0000 2022,1565455675165216770,Fabrizio Romano,"Dan James completed medicals as new Fulham player, deal agreed — while Leeds are working on a new signing after Die… https://t.co/vfT4JEeay1",Here we go! ©,"Milano, Italia",12102411,2160,20399,http://pbs.twimg.com/profile_images/1486761402853380113/3ifAqala_normal.jpg
378,Thu Sep 01 21:43:36 +0000 2022,1565455356691730434,Fabrizio Romano,"Official, confirmed. Valladolid sign Kenedy from Chelsea, it’s finally completed. 🚨 #DeadlineDay https://t.co/Zv5pvo2Az8",Here we go! ©,"Milano, Italia",12102411,2160,20399,http://pbs.twimg.com/profile_images/1486761402853380113/3ifAqala_normal.jpg
379,Thu Sep 01 21:42:31 +0000 2022,1565455084250714113,Fabrizio Romano,"Rennes are set to sign Christopher Wooh from Lens. €10m, 4 year deal agreed. Here we go. 🚨🔴 #DeadlineDay https://t.co/TPdGJIvH8u",Here we go! ©,"Milano, Italia",12102411,2160,20399,http://pbs.twimg.com/profile_images/1486761402853380113/3ifAqala_normal.jpg
380,Thu Sep 01 21:36:32 +0000 2022,1565453577350422528,Fabrizio Romano,@cdavison_afc 😂,Here we go! ©,"Milano, Italia",12102415,2160,20399,http://pbs.twimg.com/profile_images/1486761402853380113/3ifAqala_normal.jpg
381,Thu Sep 01 21:36:24 +0000 2022,1565453543888257024,Fabrizio Romano,Juventus statement reveals Liverpool have the option of making Arthur Melo’s loan move permanent next summer for fe… https://t.co/cbdjRWwR7a,Here we go! ©,"Milano, Italia",12102415,2160,20399,http://pbs.twimg.com/profile_images/1486761402853380113/3ifAqala_normal.jpg
382,Thu Sep 01 21:25:55 +0000 2022,1565450908028248064,Fabrizio Romano,Bamba Dieng has failed medical at OGC Nice after Leeds deal hijacked. It’s the most incredible story of the day. 🚨❌ #DeadlineDay,Here we go! ©,"Milano, Italia",12102415,2160,20399,http://pbs.twimg.com/profile_images/1486761402853380113/3ifAqala_normal.jpg
383,Thu Sep 01 21:22:13 +0000 2022,1565449974690766848,Fabrizio Romano,RT @FabrizioRomano: Aston Villa have rejected one more proposal from Arsenal for Douglas Luiz. Arsenal have still not left the negotiations…,Here we go! ©,"Milano, Italia",12102415,2160,20399,http://pbs.twimg.com/profile_images/1486761402853380113/3ifAqala_normal.jpg
384,Thu Sep 01 21:19:14 +0000 2022,1565449223331618816,Fabrizio Romano,"Official, confirmed. James Garner is new Everton player on permanent deal from Manchester United. 🚨🔵 #EFC… https://t.co/1DqVlcX6kg",Here we go! ©,"Milano, Italia",12102415,2160,20399,http://pbs.twimg.com/profile_images/1486761402853380113/3ifAqala_normal.jpg
385,Thu Sep 01 21:17:39 +0000 2022,1565448824826601476,Fabrizio Romano,Aston Villa have rejected one more proposal from Arsenal for Douglas Luiz. Arsenal have still not left the negotiat… https://t.co/XRVae8kKWi,Here we go! ©,"Milano, Italia",12102415,2160,20399,http://pbs.twimg.com/profile_images/1486761402853380113/3ifAqala_normal.jpg
386,Thu Sep 01 21:08:06 +0000 2022,1565446424531279879,Fabrizio Romano,@josepcapdevila ✅,Here we go! ©,"Milano, Italia",12102415,2160,20399,http://pbs.twimg.com/profile_images/1486761402853380113/3ifAqala_normal.jpg
